{
    "renderer": "homeworlds",
    "board": [
        {
            "name": "Alice",
            "seat": "N",
            "stars": ["R3", "G2"]
        },
        {
            "name": "Bob",
            "seat": "S",
            "stars": ["B2", "Y3"]
        },
        {
            "name": "Charley",
            "seat": "E",
            "stars": ["R3", "G2"]
        },
        {
            "name": "David",
            "seat": "W",
            "stars": ["B2", "Y3"]
        },
        {
            "name": "Perl",
            "stars": ["B1"]
        },
        {
            "name": "Ruby",
            "stars": ["Y2"]
        },
        {
            "name": "Python",
            "stars": ["R3"]
        },
        {
            "name": "CSharp",
            "stars": ["G2"]
        }        
    ],
    "pieces": [
        ["Y3N"],
        ["R3S"],
        ["B3N"],
        ["G3S"],
        ["R1N", "B2E", "G3S", "G1W", "R2S", "B3N"],
        ["B2N"],
        ["R1E"],
        ["G2W", "Y1S"]
    ],
    "areas": [
        {
            "R": "111112222233333",
            "B": "111112222233333",
            "G": "111112222233333",
            "Y": "111112222233333"
        }
    ],
    "legend": {
        "R1": {
            "name": "pyramid-up-small-upscaled",
            "player": 1
        },
        "R2": {
            "name": "pyramid-up-medium-upscaled",
            "player": 1
        },
        "R3": {
            "name": "pyramid-up-large-upscaled",
            "player": 1
        },
        "B1": {
            "name": "pyramid-up-small-upscaled",
            "player": 2
        },
        "B2": {
            "name": "pyramid-up-medium-upscaled",
            "player": 2
        },
        "B3": {
            "name": "pyramid-up-large-upscaled",
            "player": 2
        },
        "G1": {
            "name": "pyramid-up-small-upscaled",
            "player": 3
        },
        "G2": {
            "name": "pyramid-up-medium-upscaled",
            "player": 3
        },
        "G3": {
            "name": "pyramid-up-large-upscaled",
            "player": 3
        },
        "Y1": {
            "name": "pyramid-up-small-upscaled",
            "player": 4
        },
        "Y2": {
            "name": "pyramid-up-medium-upscaled",
            "player": 4
        },
        "Y3": {
            "name": "pyramid-up-large-upscaled",
            "player": 4
        },
        "R1N": {
            "name": "pyramid-flat-small",
            "player": 1,
            "rotate": 180
        },
        "R2N": {
            "name": "pyramid-flat-medium",
            "player": 1,
            "rotate": 180
        },
        "R3N": {
            "name": "pyramid-flat-large",
            "player": 1,
            "rotate": 180
        },
        "B1N": {
            "name": "pyramid-flat-small",
            "player": 2,
            "rotate": 180
        },
        "B2N": {
            "name": "pyramid-flat-medium",
            "player": 2,
            "rotate": 180
        },
        "B3N": {
            "name": "pyramid-flat-large",
            "player": 2,
            "rotate": 180
        },
        "G1N": {
            "name": "pyramid-flat-small",
            "player": 3,
            "rotate": 180
        },
        "G2N": {
            "name": "pyramid-flat-medium",
            "player": 3,
            "rotate": 180
        },
        "G3N": {
            "name": "pyramid-flat-large",
            "player": 3,
            "rotate": 180
        },
        "Y1N": {
            "name": "pyramid-flat-small",
            "player": 4,
            "rotate": 180
        },
        "Y2N": {
            "name": "pyramid-flat-medium",
            "player": 4,
            "rotate": 180
        },
        "Y3N": {
            "name": "pyramid-flat-large",
            "player": 4,
            "rotate": 180
        },
        "R1S": {
            "name": "pyramid-flat-small",
            "player": 1
        },
        "R2S": {
            "name": "pyramid-flat-medium",
            "player": 1
        },
        "R3S": {
            "name": "pyramid-flat-large",
            "player": 1
        },
        "B1S": {
            "name": "pyramid-flat-small",
            "player": 2
        },
        "B2S": {
            "name": "pyramid-flat-medium",
            "player": 2
        },
        "B3S": {
            "name": "pyramid-flat-large",
            "player": 2
        },
        "G1S": {
            "name": "pyramid-flat-small",
            "player": 3
        },
        "G2S": {
            "name": "pyramid-flat-medium",
            "player": 3
        },
        "G3S": {
            "name": "pyramid-flat-large",
            "player": 3
        },
        "Y1S": {
            "name": "pyramid-flat-small",
            "player": 4
        },
        "Y2S": {
            "name": "pyramid-flat-medium",
            "player": 4
        },
        "Y3S": {
            "name": "pyramid-flat-large",
            "player": 4
        },
        "R1E": {
            "name": "pyramid-flat-small",
            "player": 1,
            "rotate": -90
        },
        "R2E": {
            "name": "pyramid-flat-medium",
            "player": 1,
            "rotate": -90
        },
        "R3E": {
            "name": "pyramid-flat-large",
            "player": 1,
            "rotate": -90
        },
        "B1E": {
            "name": "pyramid-flat-small",
            "player": 2,
            "rotate": -90
        },
        "B2E": {
            "name": "pyramid-flat-medium",
            "player": 2,
            "rotate": -90
        },
        "B3E": {
            "name": "pyramid-flat-large",
            "player": 2,
            "rotate": -90
        },
        "G1E": {
            "name": "pyramid-flat-small",
            "player": 3,
            "rotate": -90
        },
        "G2E": {
            "name": "pyramid-flat-medium",
            "player": 3,
            "rotate": -90
        },
        "G3E": {
            "name": "pyramid-flat-large",
            "player": 3,
            "rotate": -90
        },
        "Y1E": {
            "name": "pyramid-flat-small",
            "player": 4,
            "rotate": -90
        },
        "Y2E": {
            "name": "pyramid-flat-medium",
            "player": 4,
            "rotate": -90
        },
        "Y3E": {
            "name": "pyramid-flat-large",
            "player": 4,
            "rotate": -90
        },
        "R1W": {
            "name": "pyramid-flat-small",
            "player": 1,
            "rotate": 90
        },
        "R2W": {
            "name": "pyramid-flat-medium",
            "player": 1,
            "rotate": 90
        },
        "R3W": {
            "name": "pyramid-flat-large",
            "player": 1,
            "rotate": 90
        },
        "B1W": {
            "name": "pyramid-flat-small",
            "player": 2,
            "rotate": 90
        },
        "B2W": {
            "name": "pyramid-flat-medium",
            "player": 2,
            "rotate": 90
        },
        "B3W": {
            "name": "pyramid-flat-large",
            "player": 2,
            "rotate": 90
        },
        "G1W": {
            "name": "pyramid-flat-small",
            "player": 3,
            "rotate": 90
        },
        "G2W": {
            "name": "pyramid-flat-medium",
            "player": 3,
            "rotate": 90
        },
        "G3W": {
            "name": "pyramid-flat-large",
            "player": 3,
            "rotate": 90
        },
        "Y1W": {
            "name": "pyramid-flat-small",
            "player": 4,
            "rotate": 90
        },
        "Y2W": {
            "name": "pyramid-flat-medium",
            "player": 4,
            "rotate": 90
        },
        "Y3W": {
            "name": "pyramid-flat-large",
            "player": 4,
            "rotate": 90
        }
    }
}